{
  "schema_version": "1.0.0",
  "draw": {
    "operator_id": "OPERATOR_PSEUDONYM",
    "draw_no": 999999,
    "draw_date": "2099-01-01",
    "draw_scheduled_at": "2099-01-01T20:35:00+09:00",
    "draw_actual_at": "2099-01-01T20:36:12+09:00",
    "prediction_lock_at": "2099-01-01T19:00:00+09:00",
    "venue_id": "VENUE_PSEUDONYM",
    "schedule_delay_sec": 72
  },
  "machine": {
    "machine_id": "MACHINE_PSEUDONYM_A",
    "model_id": "MODEL_PSEUDONYM",
    "generation": "GEN_PSEUDONYM",
    "serial_hash": "SERIAL_HASH_PSEUDONYM",
    "commissioned_at": "2098-01-01T00:00:00+09:00",
    "last_service_at": "2098-12-01T10:00:00+09:00",
    "draws_since_service": 4,
    "cumulative_draw_count": 120,
    "selection_observed_at": "2099-01-01T17:00:00+09:00",
    "selection_available_at": "2099-01-01T17:05:00+09:00"
  },
  "ball_set": {
    "ball_set_id": "BALLSET_PSEUDONYM_B",
    "generation": "BALL_GEN_PSEUDONYM",
    "commissioned_at": "2098-06-01T00:00:00+09:00",
    "retired_at": null,
    "last_certified_at": "2098-12-15T09:00:00+09:00",
    "draws_since_certification": 2,
    "cumulative_draw_count": 40,
    "selection_observed_at": "2099-01-01T17:10:00+09:00",
    "selection_available_at": "2099-01-01T17:15:00+09:00"
  },
  "pre_draw_tests": {
    "test_count": 2,
    "pass_count": 2,
    "fail_count": 0,
    "condition_id": "CONDITION_PSEUDONYM",
    "completed_at": "2099-01-01T18:20:00+09:00"
  },
  "operations": {
    "warmup_duration_sec": 900,
    "mixing_duration_sec": 30,
    "airflow_setting": "SETTING_PSEUDONYM",
    "power_voltage_v": 220.1,
    "power_frequency_hz": 60.0,
    "vibration_rms": 0.01
  },
  "environment": {
    "indoor_temperature_c": 22.4,
    "indoor_relative_humidity_pct": 45.0,
    "indoor_air_pressure_hpa": 1012.3,
    "sensor_id": "SENSOR_PSEUDONYM",
    "window_start_at": "2099-01-01T18:00:00+09:00",
    "window_end_at": "2099-01-01T19:00:00+09:00",
    "sensor_calibration_id": "CALIBRATION_PSEUDONYM"
  },
  "ball_measurements": null,
  "provenance": {
    "source_system": "SOURCE_SYSTEM_PSEUDONYM",
    "source_record_id": "SOURCE_RECORD_PSEUDONYM",
    "recorded_at": "2099-01-01T18:25:00+09:00",
    "available_at": "2099-01-01T18:30:00+09:00",
    "source_published_at": null,
    "ingested_at": "2099-01-01T18:40:00+09:00",
    "record_hash": "aaaaaaaaaaaaaaaaaaaaaaaaaaaaaaaaaaaaaaaaaaaaaaaaaaaaaaaaaaaaaaaa",
    "correction_status": "ORIGINAL",
    "correction_id": null,
    "previous_record_hash": null
  },
  "availability": {
    "classification": "A0_DEPLOYABLE",
    "classified_at": "2099-01-01T18:45:00+09:00",
    "classification_basis": "available_at precedes prediction_lock_at"
  },
  "quality": {
    "evidence_level": "E2_SAMPLED",
    "reliability_score": 0.95,
    "join_status": "EXACT",
    "contains_outcome_information": false,
    "contains_personal_information": false,
    "validation_notes": "Synthetic dummy record only"
  }
}
